"ID","Category","DispelType","Mechanic","Attributes","AttributesEx","AttributesExB","AttributesExC","AttributesExD","AttributesExE","AttributesExF","AttributesExG","ShapeshiftMask","ShapeshiftExclude","Targets","TargetCreatureType","RequiresSpellFocus","FacingCasterFlags","CasterAuraState","TargetAuraState","ExcludeCasterAuraState","ExcludeTargetAuraState","CasterAuraSpell","TargetAuraSpell","ExcludeCasterAuraSpell","ExcludeTargetAuraSpell","CastingTimeIndex","RecoveryTime","CategoryRecoveryTime","InterruptFlags","AuraInterruptFlags","ChannelInterruptFlags","ProcTypeMask","ProcChance","ProcCharges","MaxLevel","BaseLevel","SpellLevel","DurationIndex","PowerType","ManaCost","ManaCostPerLevel","ManaPerSecond","ManaPerSecondPerLevel","RangeIndex","Speed","ModalNextSpell","CumulativeAura","Totem_1","Totem_2","Reagent_1","Reagent_2","Reagent_3","Reagent_4","Reagent_5","Reagent_6","Reagent_7","Reagent_8","ReagentCount_1","ReagentCount_2","ReagentCount_3","ReagentCount_4","ReagentCount_5","ReagentCount_6","ReagentCount_7","ReagentCount_8","EquippedItemClass","EquippedItemSubclass","EquippedItemInvTypes","Effect_1","Effect_2","Effect_3","EffectDieSides_1","EffectDieSides_2","EffectDieSides_3","EffectRealPointsPerLevel_1","EffectRealPointsPerLevel_2","EffectRealPointsPerLevel_3","EffectBasePoints_1","EffectBasePoints_2","EffectBasePoints_3","EffectMechanic_1","EffectMechanic_2","EffectMechanic_3","ImplicitTargetA_1","ImplicitTargetA_2","ImplicitTargetA_3","ImplicitTargetB_1","ImplicitTargetB_2","ImplicitTargetB_3","EffectRadiusIndex_1","EffectRadiusIndex_2","EffectRadiusIndex_3","EffectAura_1","EffectAura_2","EffectAura_3","EffectAuraPeriod_1","EffectAuraPeriod_2","EffectAuraPeriod_3","EffectMultipleValue_1","EffectMultipleValue_2","EffectMultipleValue_3","EffectChainTargets_1","EffectChainTargets_2","EffectChainTargets_3","EffectItemType_1","EffectItemType_2","EffectItemType_3","EffectMiscValue_1","EffectMiscValue_2","EffectMiscValue_3","EffectMiscValueB_1","EffectMiscValueB_2","EffectMiscValueB_3","EffectTriggerSpell_1","EffectTriggerSpell_2","EffectTriggerSpell_3","EffectPointsPerCombo_1","EffectPointsPerCombo_2","EffectPointsPerCombo_3","EffectSpellClassMaskA_1","EffectSpellClassMaskA_2","EffectSpellClassMaskA_3","EffectSpellClassMaskB_1","EffectSpellClassMaskB_2","EffectSpellClassMaskB_3","EffectSpellClassMaskC_1","EffectSpellClassMaskC_2","EffectSpellClassMaskC_3","SpellVisualID_1","SpellVisualID_2","SpellIconID","ActiveIconID","SpellPriority","Name_Lang_enUS","Name_Lang_enGB","Name_Lang_koKR","Name_Lang_frFR","Name_Lang_deDE","Name_Lang_enCN","Name_Lang_zhCN","Name_Lang_enTW","Name_Lang_zhTW","Name_Lang_esES","Name_Lang_esMX","Name_Lang_ruRU","Name_Lang_ptPT","Name_Lang_ptBR","Name_Lang_itIT","Name_Lang_Unk","Name_Lang_Mask","NameSubtext_Lang_enUS","NameSubtext_Lang_enGB","NameSubtext_Lang_koKR","NameSubtext_Lang_frFR","NameSubtext_Lang_deDE","NameSubtext_Lang_enCN","NameSubtext_Lang_zhCN","NameSubtext_Lang_enTW","NameSubtext_Lang_zhTW","NameSubtext_Lang_esES","NameSubtext_Lang_esMX","NameSubtext_Lang_ruRU","NameSubtext_Lang_ptPT","NameSubtext_Lang_ptBR","NameSubtext_Lang_itIT","NameSubtext_Lang_Unk","NameSubtext_Lang_Mask","Description_Lang_enUS","Description_Lang_enGB","Description_Lang_koKR","Description_Lang_frFR","Description_Lang_deDE","Description_Lang_enCN","Description_Lang_zhCN","Description_Lang_enTW","Description_Lang_zhTW","Description_Lang_esES","Description_Lang_esMX","Description_Lang_ruRU","Description_Lang_ptPT","Description_Lang_ptBR","Description_Lang_itIT","Description_Lang_Unk","Description_Lang_Mask","AuraDescription_Lang_enUS","AuraDescription_Lang_enGB","AuraDescription_Lang_koKR","AuraDescription_Lang_frFR","AuraDescription_Lang_deDE","AuraDescription_Lang_enCN","AuraDescription_Lang_zhCN","AuraDescription_Lang_enTW","AuraDescription_Lang_zhTW","AuraDescription_Lang_esES","AuraDescription_Lang_esMX","AuraDescription_Lang_ruRU","AuraDescription_Lang_ptPT","AuraDescription_Lang_ptBR","AuraDescription_Lang_itIT","AuraDescription_Lang_Unk","AuraDescription_Lang_Mask","ManaCostPct","StartRecoveryCategory","StartRecoveryTime","MaxTargetLevel","SpellClassSet","SpellClassMask_1","SpellClassMask_2","SpellClassMask_3","MaxTargets","DefenseType","PreventionType","StanceBarOrder","EffectChainAmplitude_1","EffectChainAmplitude_2","EffectChainAmplitude_3","MinFactionID","MinReputation","RequiredAuraVision","RequiredTotemCategoryID_1","RequiredTotemCategoryID_2","RequiredAreasID","SchoolMask","RuneCostID","SpellMissileID","PowerDisplayID","Field227","Field228","Field229","SpellDescriptionVariableID","SpellDifficultyID"
"68641","0","0","0","0","136","4","256","0","33800","0","0","0","0","0","0","0","0","0","0","0","0","0","0","0","68529","1","0","0","0","0","0","0","101","0","0","80","80","39","0","0","0","0","0","2","0","0","0","0","0","0","0","0","0","0","0","0","0","0","0","0","0","0","0","0","0","-1","0","0","2","6","0","41","1","0","0","0","0","159","-1","0","0","0","0","18","18","0","16","16","0","52","52","0","0","4","0","0","0","0","0","0","0","0","0","0","0","0","0","0","0","0","0","0","0","0","0","0","0","0","0","0","0","0","0","0","0","0","0","0","0","0","2087","0","0","Alluring Perfume","매혹적인 유혹의 향수","Parfum séducteur","Verführerisches Parfüm","诱惑香水","誘惑香水","Perfume atrayente","Perfume atrayente","Чарующие духи","","","","","","","","16712190","","","","","","","","","","","","","","","","","16712188","Inflicts $s1 Nature damage every second.","매초마다 $s1의 자연 피해를 입힙니다.","Inflige $s1 points de dégâts de Nature toutes les secondes.","Verursacht pro Sekunde $s1 Naturschaden.","每秒造成$s1点自然伤害。","每秒造成$s1點自然傷害。","Inflige $s1 p. de daño de Naturaleza cada segundo.","Inflige $s1 p. de daño de Naturaleza cada segundo.","Наносит $s1 ед. урона от сил природы каждую секунду.","","","","","","","","16712190","$s1 damage inflicted every second.","매초마다 $s1의 피해","$s1 points de dégâts infligés toutes les secondes.","Fügt pro Sekunde $s1 Schaden zu.","每秒受到$s1点自然伤害。","每秒造成$s1點傷害。","$s1 p. de daño cada segundo.","$s1 p. de daño cada segundo.","Каждую секунду наносится $s1 ед. урона.","","","","","","","","16712190","0","0","0","0","0","0","0","0","0","0","0","0","1","1","1","0","0","0","0","0","0","8","0","0","0","0","0","0","0","0"
"68607","0","0","0","0","200","4","0","0","134250496","0","0","0","0","0","0","0","0","0","0","0","0","0","0","0","0","1","0","0","9","0","8","0","101","0","0","80","80","27","0","0","0","0","0","2","0","0","0","0","0","0","0","0","0","0","0","0","0","0","0","0","0","0","0","0","0","-1","0","0","6","6","0","241","71","1","0","0","0","1079","314","-1","0","0","0","1","6","0","0","24","0","0","61","0","4","3","0","0","1000","0","0","0","0","0","0","0","0","0","0","0","0","0","0","0","0","0","0","0","0","0","0","0","0","0","0","0","0","0","0","0","14543","0","1974","0","0","Alluring Perfume Spray","매혹적인 유혹의 향수 뿌리기","Vaporisation de parfum séducteur","Verführerisches Parfümspray","喷洒诱惑香水","誘惑香水噴霧","Pulverizador de perfume atrayente","Pulverizador de perfume atrayente","Аромат чарующих духов","","","","","","","","16712190","","","","","","","","","","","","","","","","","16712172","$s2 Nature damage inflicted every $t2 sec to enemies in a cone in front of the caster.","시전자 전방의 적에게 매 $t2초마다 $s2의 자연 피해를 입힙니다.","$s2 points de dégâts de Nature infligés toutes les $t2 sec. aux ennemis se trouvant dans un cône devant le lanceur.","Fügt Feinden in einem kegelförmigen Bereich vor dem Zaubernden alle $t2 Sek. $s2 Naturschaden zu.","每$t2秒对施法者面前一个锥形区域内的敌人造成$s2点自然伤害。","對施法者前方錐形範圍內每$t2秒造成$s2點自然傷害。","Inflige $s2 p. de daño de Naturaleza cada $t2 s a los enemigos en un cono frente al taumaturgo.","Inflige $s2 p. de daño de Naturaleza cada $t2 s a los enemigos en un cono frente al taumaturgo.","Нанесение $s2 ед. урона от сил природы раз в $t2 с. противникам в конусе поражения перед заклинателем.","","","","","","","","16712190","$o1 damage inflicted over $d.","$d에 걸쳐 $o1의 피해","$o1 points de dégâts infligés en $d.","Erleidet $d lang insgesamt $o1 Schaden.","在$d内受到$o1点伤害。","在$d內造成$o1點傷害。","$o1 p. de daño infligidos durante $d.","$o1 p. de daño infligidos durante $d.","Получение $o1 ед. урона за $d.","","","","","","","","16712190","0","0","0","0","0","0","0","0","0","0","0","0","1","1","1","0","0","0","0","0","0","8","0","0","0","0","0","0","0","0"
"68821","0","0","0","0","268435656","4","8192","0","557056","1024","0","0","0","0","0","0","0","0","0","0","0","0","0","0","0","14","0","0","9","0","0","0","101","0","0","80","80","39","0","0","0","0","0","2","0","0","0","0","0","0","0","0","0","0","0","0","0","0","0","0","0","0","0","0","0","-1","0","0","2","6","0","91","1","1","0","0","0","854","-1","-1","0","0","0","22","1","0","15","0","0","13","0","0","0","26","0","0","0","0","0","0","0","0","0","0","0","0","0","0","0","0","0","0","0","0","0","0","0","0","0","0","0","0","0","0","0","0","0","0","14575","0","1974","0","0","Chain Reaction","연쇄 반응","Réaction en chaîne","Kettenreaktion","链式反应","連鎖反應","Reacción en cadena","Reacción en cadena","Цепная реакция","","","","","","","","16712190","","","","","","","","","","","","","","","","","16712172","Inflicts $s1 Fire damage to nearby enemies.","주위 적에게 $s1 의 화염 피해를 입힙니다.","Inflige $s1 points de dégâts de Feu aux ennemis proches.","Fügt nahen Feinden $s1 Naturschaden zu.","对附近的敌人造成$s1点火焰伤害。","對周圍敵人造成$s1點火焰傷害。","Inflige $s1 p. de daño de Fuego a los enemigos cercanos.","Inflige $s1 p. de daño de Fuego a los enemigos cercanos.","Наносит $s1 ед. урона от огня ближайшим противникам.","","","","","","","","16712190","","","","","","","","","","","","","","","","","16712188","0","0","0","0","0","0","0","0","0","0","0","0","1","1","1","0","0","0","0","0","0","4","0","0","0","0","0","0","0","0"
"68927","0","0","0","67108864","136","4","0","8192","33792","0","67108864","0","0","0","0","0","0","0","0","0","0","0","0","0","68529","1","0","0","0","0","0","0","101","0","0","80","80","65","0","0","0","0","0","5","0","0","0","0","0","0","0","0","0","0","0","0","0","0","0","0","0","0","0","0","0","-1","0","0","2","6","0","51","1","0","0","0","0","224","-1","0","0","0","0","25","25","0","0","0","0","0","0","0","0","4","0","0","0","0","0","0","0","0","0","0","0","0","0","0","0","0","0","0","0","0","0","0","0","0","0","0","0","0","0","0","0","0","0","0","0","0","110","0","0","Concentrated Alluring Perfume Spill","매혹적인 유혹의 향수 농축액 쏟기","Giclée de parfum séducteur concentré","Konzentriertes verführerisches Parfüm verschütten","泼洒浓缩的诱惑香水","濃縮誘惑香水散溢","Derrame de perfume atrayente concentrado","Derrame de perfume atrayente concentrado","Облако чарующих духов","","","","","","","","16712190","","","","","","","","","","","","","","","","","16712188","Inflicts $s1 Nature damage to an enemy every $t1 sec..","적에게 매 $t1초마다 $s1의 자연 피해를 입힙니다.","Inflige $s1 points de dégâts de Nature à un ennemi toutes les $t1 sec.","Fügt einem Feind alle $t1 Sek. $s1 Naturschaden zu.","对一名敌人每$t1秒造成$s1点自然伤害。","對一名敵人每$t1秒造成$s1點自然傷害。","Inflige $s1 p. de daño de Naturaleza a un enemigo cada $t1 s.","Inflige $s1 p. de daño de Naturaleza a un enemigo cada $t1 s.","Наносит противнику $s1 ед. урона от сил природы раз в $t1 с.","","","","","","","","16712190","$s1 Nature damage every second.","매초마다 $s1의 자연 피해","$s1 points de dégâts de Nature toutes les secondes.","Fügt pro Sekunde $s1 Naturschaden zu.","每秒$s1点自然伤害。","每秒造成$s1點自然傷害。","$s1 p. de daño de Naturaleza cada segundo.","$s1 p. de daño de Naturaleza cada segundo.","Каждую секунду наносится $s1 ед. урона от сил природы.","","","","","","","","16712190","0","0","0","0","0","0","0","0","0","0","0","0","1","1","1","0","0","0","0","0","0","8","0","0","0","0","0","0","0","0"
"68934","0","0","0","67108864","136","4","0","8192","33792","0","67108864","0","0","0","0","0","0","0","0","0","0","0","0","0","68530","1","0","0","0","0","0","0","101","0","0","80","80","65","0","0","0","0","0","5","0","0","0","0","0","0","0","0","0","0","0","0","0","0","0","0","0","0","0","0","0","-1","0","0","2","6","0","251","1","0","0","0","0","224","-1","0","0","0","0","25","25","0","0","0","0","0","0","0","0","4","0","0","0","0","0","0","0","0","0","0","0","0","0","0","0","0","0","0","0","0","0","0","0","0","0","0","0","0","0","0","0","0","0","0","0","0","247","0","0","Concentrated Irresistible Cologne Spill","은은한 매력의 향수 농축액 쏟기","Giclée d'eau de Cologne irrésistible concentrée","Konzentriertes unwiderstehliches Duftwasser verschütten","泼洒浓缩的迷魅古龙水","濃縮情迷古龍水散溢","Derrame de colonia irresistible concentrada","Derrame de colonia irresistible concentrada","Облако неодолимо притягательного одеколона","","","","","","","","16712190","","","","","","","","","","","","","","","","","16712188","Inflicts $s1 Nature damage to an enemy every $t1 sec..","적에게 매 $t1초마다 $s1의 자연 피해를 입힙니다.","Inflige $s1 points de dégâts de Nature à un ennemi toutes les $t1 sec.","Fügt einem Feind alle $t1 Sek. $s1 Naturschaden zu.","对一名敌人每$t1秒造成$s1点自然伤害。","對一名敵人每$t1秒造成$s1點自然傷害。","Inflige $s1 p. de daño de Naturaleza a un enemigo cada $t1 s.","Inflige $s1 p. de daño de Naturaleza a un enemigo cada $t1 s.","Наносит противнику $s1 ед. урона от сил природы раз в $t1 с.","","","","","","","","16712190","$s1 Nature damage every second.","매초마다 $s1의 자연 피해","$s1 points de dégâts de Nature toutes les secondes.","Fügt pro Sekunde $s1 Naturschaden zu.","每秒$s1点自然伤害。","每秒造成$s1點自然傷害。","$s1 p. de daño de Naturaleza cada segundo.","$s1 p. de daño de Naturaleza cada segundo.","Каждую секунду наносится $s1 ед. урона от сил природы.","","","","","","","","16712190","0","0","0","0","0","0","0","0","0","0","0","0","1","1","1","0","0","0","0","0","0","8","0","0","0","0","0","0","0","0"
"68947","0","0","0","536870912","136","4","268435712","0","33800","0","0","0","0","0","0","0","0","0","0","0","0","0","0","0","68530","1","0","0","0","0","0","0","101","0","0","80","80","65","0","0","0","0","0","2","0","0","0","0","0","0","0","0","0","0","0","0","0","0","0","0","0","0","0","0","0","-1","0","0","2","6","0","41","0","0","0","0","0","159","0","0","0","0","0","18","18","0","16","16","0","52","52","0","0","4","0","0","0","0","0","0","0","0","0","0","0","0","0","0","0","0","0","0","0","0","0","0","0","0","0","0","0","0","0","0","0","0","0","0","0","0","3611","0","0","Irresistible Cologne","은은한 매력의 향수","Eau de Cologne irrésistible","Unwiderstehliches Duftwasser","无法抗拒的古龙水","情迷古龍水","Colonia irresistible","Colonia irresistible","Неодолимо притягательный одеколон","","","","","","","","16712190","","","","","","","","","","","","","","","","","16712188","Inflicts $s1 Nature damage every second.","매초마다 $s1의 자연 피해","Inflige $s1 points de dégâts de Nature toutes les secondes.","Verursacht pro Sekunde $s1 Naturschaden.","每秒造成$s1点自然伤害。","每秒造成$s1點自然傷害。","Inflige $s1 p. de daño de Naturaleza cada segundo.","Inflige $s1 p. de daño de Naturaleza cada segundo.","Наносит $s1 ед. урона от сил природы каждую секунду.","","","","","","","","16712190","$s1 damage inflicted every second.","매초마다 $s1의 피해","$s1 points de dégâts infligés toutes les secondes.","Fügt pro Sekunde $s1 Naturschaden zu.","每秒造成$s1点伤害。","每秒造成$s1點傷害。","$s1 p. de daño cada segundo.","$s1 p. de daño cada segundo.","Каждую секунду наносится $s1 ед. урона.","","","","","","","","16712190","0","0","0","0","0","0","0","0","0","0","0","0","1","1","1","0","0","0","0","0","0","8","0","0","0","0","0","0","0","0"
"68948","0","0","0","0","200","4","0","0","134250496","1024","0","0","0","0","0","0","0","0","0","0","0","0","0","0","0","1","0","0","9","0","8","0","101","0","0","80","80","27","0","0","0","0","0","2","0","0","0","0","0","0","0","0","0","0","0","0","0","0","0","0","0","0","0","0","0","-1","0","0","6","6","0","241","71","1","0","0","0","1079","314","-1","0","0","0","1","6","0","0","24","0","0","61","0","4","3","0","0","1000","0","0","0","0","0","0","0","0","0","0","0","0","0","0","0","0","0","0","0","0","0","0","0","0","0","0","0","0","0","0","0","14544","0","1974","0","0","Irresistible Cologne Spray","은은한 매력의 향수 뿌리기","Vaporisation d'eau de Cologne irrésistible","Unwiderstehliches Duftwasserspray","Irresistible Cologne Spray","情迷古龍水噴霧","Pulverizador de colonia irresistible","Pulverizador de colonia irresistible","Аромат неодолимо притягательного одеколона","","","","","","","","16712190","","","","","","","","","","","","","","","","","16712188","$s2 Nature damage inflicted every $t2 sec to enemies in a cone in front of the caster.","시전자 전방의 적에게 매 $t2초마다 $s2의 자연 피해를 입힙니다.","$s2 points de dégâts de Nature infligés toutes les $t2 sec. aux ennemis se trouvant dans un cône devant le lanceur.","Fügt Feinden in einem kegelförmigen Bereich vor dem Zaubernden alle $t2 Sek. $s2 Naturschaden zu.","每$t2秒对施法者面前一个锥形区域内的敌人造成$s2点自然伤害。","對施法者前方錐形範圍內每$t2秒造成$s2點自然傷害。","Inflige $s2 p. de daño de Naturaleza cada $t2 s a los enemigos en un cono frente al taumaturgo.","Inflige $s2 p. de daño de Naturaleza cada $t2 s a los enemigos en un cono frente al taumaturgo.","Наносит $s2 ед. урона от сил природы раз в $t2 сек. противникам в конусе поражения перед заклинателем.","","","","","","","","16712190","$o1 damage inflicted over $d.","$d에 걸쳐 $o1의 피해","$o1 points de dégâts infligés en $d.","Erleidet $d lang insgesamt $o1 Schaden.","在$d内受到$o1点伤害。","在$d內造成$o1點傷害。","$o1 p. de daño infligidos durante $d.","$o1 p. de daño infligidos durante $d.","$o1 ед. урона в течение $d.","","","","","","","","16712190","0","0","0","0","0","0","0","0","0","0","0","0","1","1","1","0","0","0","0","0","0","8","0","0","0","0","0","0","0","0"
"68957","0","0","0","67108864","136","4","0","0","33792","0","0","0","0","0","0","0","0","0","0","0","0","0","0","0","0","1","0","0","0","0","0","0","101","0","0","80","80","0","0","0","0","0","0","140","0","0","0","0","0","0","0","0","0","0","0","0","0","0","0","0","0","0","0","0","0","-1","0","0","2","2","2","1","1",51,"0","0","0","0","49999",224,"0","0","0","18","1","18","8","0","16","29","0","29","0","0","0","0","0","0","0","0","0","0","0","0","0","0","0","0","0","0","0","0","0","0","0","0","0","0","0","0","0","0","0","0","0","0","0","0","14573","0","3611","0","0","Unstable Reaction","불안정한 반응","Réaction instable","Instabile Reaktion","不稳定反应","不穩定的反應","Reacción inestable","Reacción inestable","Нестабильная реакция","","","","","","","","16712190","","","","","","","","","","","","","","","","","16712172","Inflicts $s3 Nature damage to nearby enemies, but kills the caster.","주위 적에게 $s3의 자연 피해를 입히고 시전자는 사망합니다.","Inflige $s3 points de dégâts de Nature aux ennemis proches, mais tue le lanceur.","Fügt nahen Feinden $s3 Naturschaden zu, tötet jedoch den Zaubernden.","对周围的敌人造成$s3点自然伤害，但会使施法者死亡。","對周圍敵人造成$s3點自然傷害，但將會殺死施法者。","Inflige $s3 p. de daño de Naturaleza a los enemigos cercanos, pero mata al taumaturgo.","Inflige $s3 p. de daño de Naturaleza a los enemigos cercanos, pero mata al taumaturgo.","Наносит $s3 ед. урона от сил природы ближайшим противникам, убивая при этом заклинателя.","","","","","","","","16712190","","","","","","","","","","","","","","","","","16712188","0","0","0","0","0","0","0","0","0","0","0","0","1","1","1","0","0","0","0","0","0","8","0","0","0","0","0","0","0","0"